<?xml version="1.0" encoding="UTF-8"?>
<xs:schema xmlns:xs="http://www.w3.org/2001/XMLSchema">
   <xs:element name="scenariodata">
      <xs:complexType>
         <xs:sequence>
            <xs:element name="signuppage">
               <xs:complexType>
                  <xs:sequence>
                     <xs:element name = "name" type = "xs:string"/>
                     <xs:element name = "emailaddress" type = "xs:string"/>
                  </xs:sequence>
                </xs:complexType>
            </xs:element>
             <xs:element name="accountinfopage">
               <xs:complexType>
                  <xs:sequence>
                     <xs:element name = "firstname" type = "xs:string"/>
                     <xs:element name = "lastname" type = "xs:string"/>
                     <xs:element name = "company" type = "xs:string" minOccurs="0" />
                  </xs:sequence>
                </xs:complexType>
            </xs:element>
         </xs:sequence>
      </xs:complexType>
   </xs:element>
</xs:schema>